评论ID,客户类型,住宿时长,问题分类,评论长度,评论内容
784,商务客户,未知,"房间设施, 位置交通",284,"几乎找不到缺点的完美入住体验
房间非常干净舒适，环境优雅，干湿分离，配套用品非常贴心，还准备了丝瓜络，注重细节
房间里就提供了非常充足的饮用水，还有当地特色饮品、水果和小零食，银耳汤也很好喝
再说服务，这家酒店真的做到了宾至如归，从踏入大堂那一刻起，就能感受到工作人员的热情，从门口的管家到前台到客房服务人员，在酒店里遇到的每一位工作人员都是面带微笑，主动打招呼，热心提供咨询。
尤其我的管家小方和小..."
795,普通客户,未知,清洁卫生,9,卫生环境是没问题的
816,商务客户,未知,其他,69,前台帅哥小郭非常热情。服务很好。说话很温柔。管家小帅小代很热心的给我们解决入住。及时解决问题。外卖也能由她们工作人员亲自送上楼。棒棒哒👍🏻
825,普通客户,未知,价格争议,96,住过贵阳安珀就被种草了，这次到乐山毫不犹豫就定了乐山安珀，服务还是一如既往的好，管家小代和小帅有求必应，前台小钱也热情，唯一就是可能春节期间小孩比较多，楼上会有一阵阵的声音。临走还送了纪念品。
844,家庭客户,未知,其他,144,"首先呢，第一次带小朋友出去，管家小周倒是安排的挺好的，把小朋友的围栏什么的都考虑到了，尽心尽责。
其次，酒店新开的，各方面都挺好的，也没有味道，希望能一直保持下去。
最后，去乐山的最优之选，没有之一。

最大的遗憾，下雨了，不然可以晚上在露台吹吹风，喝喝酒，聊聊天，那才是舒服…
展开更多"
849,普通客户,未知,"房间设施, 餐饮问题, 预订问题",107,五一假期入住的，还给免费升级了房型。电梯里香香的，房间很大，隔音也非常好。有这么问题直接问管家，回复都非常及时，服务非常棒。感谢小袁小代和小祝的细心服务。酒店的早餐也非常丰盛和好吃。位子也比较多，假期也没有很拥挤🥳
850,情侣客户,未知,"餐饮问题, 清洁卫生",64,各方面都很不错 法式浪漫 管家小雷和小帅也很不错 服务态度特别好 下次来乐山度假也来住 卫生完全没问题 下午茶很不错 早餐也好吃
859,普通客户,未知,"房间设施, 餐饮问题",135,"非常不错的酒店，服务、环境、硬件设施、餐饮不止在乐山，在四川内也是非常优秀的。
早餐非常有特色，咖啡很专业，牛肉面、甜皮鸭也非常正宗，在酒店里能做到这个程度很难得，还有现烤的牛角包。服务态度也很好，任何疑问管家小周都在10分钟内回复，这点比后面峨眉山的酒店管家优秀很多👍"
866,普通客户,未知,其他,37,管家小代 小帅很热情 进出都会问候 小郭处理问题非常迅速 很满意的一次入住
881,家庭客户,未知,"房间设施, 餐饮问题, 管理问题",454,"这次入店体验服务超乎我的预期，订酒店的费用不是很高，所以预期也不是很高。到了酒店从设施，装修的时间，风格都是自己喜欢的，设施新，复古风！
在服务方面，感觉比华尔道夫酒店的服务更加贴心，我特别注重细节，从进入酒店，管家小赵发来很多当地的特色小吃和地图，还有房间配备的水果，晚上送来的甜品和管家亲笔留下的暖心简画和贴心的字条，这些小小的细节更能打动我！
离开酒店当天雨下得特别大，准备带孩子吃早餐，联系了..."
884,普通客户,未知,"房间设施, 餐饮问题",153,酒店环境设施很不错在乐山是数一数二的，整个装修设计很有格调，就在万达广场旁边.管家Mark 一路详细介绍服务周到，入住期间有问题及时给我们解决，办入住时前台小钱还帮我们做了升级，服务态度很好，第二天早餐是点餐形式的，品质很棒还不浪费，退房时黄经理还来了解我们的入住感受，我只能说不虚此行，很棒的一次入住体验
887,朋友聚会,未知,"房间设施, 餐饮问题, 价格争议, 位置交通",308,"酒店位置离高速出口不远，到市区吃饭和景点需要开车几公里，自驾的话比较方便。

设施：房间比较宽敞，马桶有卫洗丽，吹风是戴森，洗漱用品有漱口水。早餐品种在星级酒店里不算多，优点是不像其他酒店的全自动咖啡机，而是用的半自动，所以员工现场还可以制作dirty。

服务：管家小帅、小代和前台小颖的服务很亲切、贴心；入住会引导进房间作简单介绍；欢迎水果的荔枝很新鲜，小番茄用的千禧，还赠送了一瓶玻瓶的峨眉雪；..."
894,普通客户,未知,房间设施,61,环境非常棒 服务也非常好 管家小方小雪贴心处理所有问题 而且来玩还推荐本地旅游攻略 很舒服的体验 酒店设施齐全 住的很舒服
903,普通客户,未知,"房间设施, 餐饮问题, 清洁卫生",187,"1.酒店：环境非常好，房间干净卫生，前台小钱小王服务热情，有专人陪同办理入住及送到房间。
2.服务：酒店主打电话接站，司机小祝很早就在高铁站等，还贴心的带了雨伞，主动提行李。
3.用餐：酒店早餐很丰盛，食材很棒，牛肉面牛肉超级多，服务人员随时帮忙撤换餐盘，很用心，用晚餐还有经理模样的人主动问用餐情况，满意不满意。
4.下次过来还会继续住这家酒店，也希望酒店继续保持优质服务"
907,普通客户,未知,"房间设施, 餐饮问题",154,这次挑了很久最终选择了乐山安珀，非常满意，管家小代，小税有求必应，所有问题都耐心解答，周边环境，酒店的设施时间都有详细告知，非常不错，前台小颖也很耐心专业且快速的办理入住，有人送行李到房间，从到酒店到入住都很丝滑，酒店早餐的蛋烘糕真的深得我心，我吃了4个，哈哈哈哈，下次去乐山还会选择安珀，够新，服务品质在线
910,家庭客户,未知,"房间设施, 餐饮问题",97,出门几乎都是住五星，这家安柏的硬软件很合我们的喜好。甚至可以和超五星媲美，设计审美可以算是第一梯队，出现在乐山很惊喜。设备安心，早饭好吃。管家小祝也很负责任，唯一小缺点是11岁孩子需要正价早餐。
920,普通客户,未知,"房间设施, 位置交通",63,酒店位置在万达附近，距离美食街也不算远，吃的逛的也比较方便，房间设施齐全，管家小郭小娟服务很好，前台办理入住迅速，整体还不错。
928,普通客户,未知,餐饮问题,83,酒店硬件很超前。早餐人性化，客人多了吃自助，客人少了可点餐。管家小祝接恃热情，介紹服务专业，前台小税态度热情。对办理入住很专业。建议酒店给每个楼层电梯边放一个拉圾箱。
943,普通客户,未知,其他,38,在乐山难得一见的法式风格酒店，设计风格和服务态度都很棒，感谢管家小方和小徐！
952,普通客户,未知,"房间设施, 餐饮问题, 价格争议, 位置交通",447,"这次住的真的很舒服～酒店干净又漂亮。
进门就能看到手写卡片，超级用心，烧水壶很干净，无水垢，而且烧水巨快!!!
胶囊咖啡机很新，mini bar 还有峨眉雪，荔枝味超好喝!不够还可以续，就连矿泉水都好高级。
超大浴缸非常舒适，每天睡前都有赠送水果和甜点，夜宵米糊好好喝，椰蓉小点心也好好吃，洗浴用品是艾绰的，戴森吹风机，出热水很快。
酒店位置就在万达附近，周围好吃的特别多，半夜外卖都是前台直接给送上..."
959,普通客户,未知,"房间设施, 位置交通",292,"超越期望值的体验，入住之后安排了专门的管家，非常细心的照顾到了所有需求，超级满意。

入住的时候送了果盘，桌上有手写的欢迎卡片，迷你吧赠送了各类饮品，椰子水点赞！！！可以说比成都很多上千的酒店的品质都要好。

房间的格局很合理，内部设计也非常艺术，床品很干净舒适，晚上睡了很舒服的觉！用品配置很高端，汉斯格雅的卫浴，吹风机是戴森的，意外的是还提供了乳胶枕、薰衣草枕给我们，晚上还请管家安排了中草药泡脚..."
968,情侣客户,未知,"房间设施, 餐饮问题",122,"端午节带家人一起游乐山，选择了安珀酒店
酒店设施配套齐全
房间充满法式浪漫
早餐品种也很丰富
家人在乐山留下了非常难忘的印象
要感谢本次入住为我服务的管家小帅小代和前台小颖为我们提供了宾至如归的服务
下次来乐山还是会首选安珀酒店💖💖💖
展开更多"
969,朋友聚会,未知,"餐饮问题, 价格争议, 清洁卫生",249,听朋友讲乐山新开了一家安珀酒店还不错，趁着最近有点空闲时间就和夫人一道去很久未去的乐山玩一玩，入住了乐山心念已久的安珀酒店。因为在贵阳入住过安珀酒店 ，对安珀酒店的服务、风格、卫生情况均留下了很好的印象，不免两个酒店有一些比较。总之觉得乐山的酒店各方面与贵阳差不多，都很喜欢！从一订好房开始，酒店的服务就跟上了，前台小郭、管家Lip、西餐厅服务人员均有丰富的专业水平，相当不错！对提出的一些问题及时进...
992,普通客户,未知,"房间设施, 餐饮问题, 位置交通",177,第一次来乐山，也是第一次住安珀酒店，体验非常棒。酒店管家Jessica提前一天电话联系加了微信，安排了高铁站接送，司机小周师傅还帮我们介绍了一些本地人爱去的美食，前台Lola服务也很棒。早餐是点餐制，味道不错，房间设置也很新，胶囊咖啡机，卫洗丽都被配备齐全，非要说不足的话，离老城相对远一点，打出租或者快车，20元左右。乐山两天不太够，下次考虑多住几天。
993,普通客户,未知,房间设施,54,房间很不错，很宽敞，干湿分离，床也很舒服，管家小帅很好，有问题马上就能解决，下次来还会继续选择入住这家酒店。
1001,普通客户,未知,"房间设施, 餐饮问题, 清洁卫生",213,"体验感太好了 ！房间特别舒适，干净 入住的时候错过下午茶时间 管家贴心的送了一份小甜品 好吃！第二天去爬了峨眉山 累趴了 回到酒店，竟然有用保温杯装好的暖呼呼糖水 感动坏了😄早餐也非常不错 卖相和味道都很棒！适合小姐姐们打卡拍照喔。 还有我们的管家小帅和小周 特别好 凌晨还给我们送外卖 问能不能再送一份水果 也是马上就安排上来了 总之，真的很满意 下次去乐山一定会再次入住 🥳

卫生：好
环境：优..."
1004,家庭客户,未知,"餐饮问题, 价格争议",116,自驾游经过乐山，因为住过贵阳安珀酒店觉得没可挑剔的服务后，这次也选择了乐山安珀酒店同样非常满意，特别是管家Amy需然没见本人但提前一天就联系我了解入住需求，到酒店后又推荐附近美吃，还把小朋友的早餐也免了，服务真是很贴心！必须好评👍🏻
1017,普通客户,未知,"房间设施, 餐饮问题",221,房间宽敞干净，很新的装修，还有接送高铁服务，去的时候没有用上，回程免费送到高铁站，并且管家一直帮忙把行李拿到安检处才挥手离开，这服务确实没话说，早餐出品不错，样式不太多但是胜在味道好，在酒店就可以吃到乐山特色小吃钵钵鸡，下次再来乐山必定还是安柏，不足之处就是旁边有个工地，会有一小丢丢吵，但是不是特别影响，房间小吃、饮料全部免费，而且是很好喝的葡萄味和荔枝味，管家小帅和小袁服务很棒，给你们10分，希...
1026,商务客户,未知,"房间设施, 餐饮问题, 价格争议",175,发自内心的好评，结婚纪念日原本是选的其他酒店，刷到这个酒店很多好评又是新酒店，按以往的经验新酒店都很注重服务就选了这个酒店。结果是意外的满意，给管家Lulu、Mark说了是结婚纪念日想要个小蛋糕和花，管家给安排的妥妥的，另外还有接送站服务，酒店硬件设施也很好，工作人员都很友好热情，早餐虽然简单但也胜在精致，了解到贵阳还有这家店，准备有机会也去打卡。
1031,商务客户,未知,"房间设施, 餐饮问题",197,"很少评论，这家值得，确实不错。
到酒店门口就有一个美女（管家小朱）全程陪到我们办入住，很奇怪咋个还有工作人员全程跟到呢，一问才晓得是他们家的管家式服务，蛮新鲜。
酒店是新开业的，配置不错，花洒是汉斯格雅的，吹风机是戴森的，管家小朱送来的空气净化器也是戴森的，更夸张的是电梯里、房间里的蝴蝶兰还都是鲜花，看着确实好高级。
酒店早餐不错，看的出来是用心做了。
再来乐山的话，争取再住一次。
展开更多"
1039,普通客户,未知,"餐饮问题, 价格争议",121,这家酒店是一个法国品牌，酒店没有高大尚都门头，进去后里面的装修风格也是简单，低调奢华有内涵，隐秘性做的非常好，管家小袁服务周到，下次有机会再来会再次入住，体验感非常棒，目前中国有三家店，乐山，成都，贵阳，还有一个法式西餐厅简直不要太惊艳了我，
1044,普通客户,未知,"餐饮问题, 位置交通",38,管家小周的服务很赞，早餐特别好，整体入住体验远超预期，下次来乐山吃还住这家！
