评论ID,客户类型,住宿时长,问题分类,评论长度,评论内容
224,普通客户,未知,"餐饮问题, 位置交通",264,这次去乐山旅游，花了很多时间选了这间酒店，总体来讲是没有达到预期的。硬件整体来说不错，服务这块相较丽晶、洲际这些还是存在比较大差距。简单讲几个点吧：1. 晚上睡觉时每隔一段时间有电流声，因为有宝宝告知管家已经休息了麻烦管家排查下，后面宝宝睡觉后来敲门 2.离店后管家讲有个衣架没有找到，实际上晚上用了只是挂在浴室门口，应该不算多隐蔽的位置吧 3.迎宾水果如果不是很新鲜的话建议取消，反而拉低评价； 也...
226,普通客户,未知,"房间设施, 餐饮问题, 清洁卫生",164,"设施：硬件一流，酒店造价1个亿以上，单房造价60万。

卫生：2023年新开的，卫生表现非凡。

环境：酒店坐落在住宅小区附近，景观差了点，但是好在店内环境很不错。

服务：一对一的管家服务，感觉服务人员比客人多，外卖给你送到房间。进出和退房都接送陪伴。

茉西餐厅双人午市套餐或下午茶（2选1）:酒店的西餐出品一流。
展开更多"
228,普通客户,未知,"房间设施, 餐饮问题, 价格争议, 位置交通, 管理问题",155,"安珀的设计、酒店设施、服务质量都远超期待！
酒店位置虽然不在最中心地段，周围目前还处于开发建设阶段，但是进入酒店内部根本不需要为外界这些纷扰担忧；酒店细节处的鲜花花艺也彰显品味。
早餐种类繁多，品质优良；随赠的午餐也是精致美味；健身房虽小，但也设备齐全，干净整洁。

真的是性价比很高的一次住宿体验！
展开更多"
237,普通客户,未知,"房间设施, 餐饮问题, 清洁卫生",192,私密性强，人少安静，服务比同类型同价位酒店例如英迪格贴心许多，早餐的美式口感不错，原本对附送的午餐没报什么期待结果也还可以，分量不多更像brunch，早一点吃完留点肚子下午再去城里炫小吃就很合适。房间内部中规中矩，胜在有咖啡机，操作简单快捷成功安利了懒人立刻购入了一个把家里需要清洗的老机子淘汰。美中不足是周围施工工地有点多，以及卫生间洗漱台没有专门的化妆镜。下次想来乐山吃东西会来。
243,普通客户,未知,"房间设施, 餐饮问题",135,这家酒店的服务非常周到，设施服务都达到了国际连锁的要求，在乐山这样一个充满了各种网红坑人民俗的城市里很难得。特别要感谢服务管家小代小帅和前台小赵，他们非常热情友好，帮我们解决了很多问题，还送了一个可爱的玩偶小羊。酒店的早餐非常丰富并且都是乐山本地小吃，给酒店打五星好评！
250,普通客户,未知,房间设施,51,这酒店的品质一直很高，不管的酒店装修还是服务一直都很好，这次也没有让我失望，就是这次住的房间稍微小了点
253,商务客户,未知,"服务问题, 房间设施, 餐饮问题, 预订问题",381,第一次入住乐山安珀酒店，总体的感受还是不错的，硬件方面房间内的设施都挺新，胶囊咖啡机很给力，卫浴设施也很满意，整个房间的感觉设计都很舒服。然后来说一下服务，前台工作人员很热情，提前一天就有管家联系确认到店入住时间和对房间的要求，到店后前台的小赵和小娟两位热情地为我们服务，很是周到。最后再来讲一下餐饮：这个部分是对安珀这次比较失望的地方。首先，可能是因为入住率不高，早餐可选的种类并不丰富，而且某些食...
260,商务客户,未知,"房间设施, 餐饮问题",323,"乐山安珀酒店提供了一次难忘的入住体验，将现代舒适与传统热情完美结合。酒店周围环境宁静，是放松身心的理想选择。房间宽敞明亮，装饰高雅，设施先进，确保了每位客人的舒适和便利。早餐简而精，包含当地特色小吃，晚上开夜床会送上小点心和水果，迷你吧也是免费的。
值得一提的是酒店的管家服务，管家团队表现出了非凡的专业素养和对客人需求的深刻理解。从高铁免费接站，美食游乐推荐到天气提醒，他们的服务既细致又周到。管家..."
270,普通客户,未知,其他,25,特别提醒：这里的西餐西餐差到极致，牛排完全啃不动！
274,家庭客户,未知,"房间设施, 清洁卫生",164,"酒店适合商务出差下榻还不错，私密度高。不太适合亲子旅游下榻，因为也没啥亲子可互动的场所(光线也不太明亮，不适合小朋友)。

新酒店，房间硬件很好。干净卫生，床品赞，睡得舒服。洗浴硬件包括花洒都赞。但是还是有点新装修的气味。

酒店服务人员还是比较专业，热情。

周围大环境没啥亮点，纯游玩来看，地理大环境其实比较鸡肋。
展开更多"
283,普通客户,未知,房间设施,132,管家小郭入住前提前联系为我们安排好接送站，入住时小娟早早准备好了房间，房间还为我们做了一个升级真的很贴心，始终保持微笑，入住之后小赵也是有什么问题随时联系，负责接送站的小党也是非常有耐心，很好；这次安珀旅行入住的很舒心很开心，非常感谢你们，下次来乐山继续选择安珀。
290,普通客户,未知,"餐饮问题, 位置交通",134,虽然入住的时候酒店大门正在改造，办理入住有些不方便，但是这点小小瑕疵完全被前台小赵和管家小郭的热情服务消灭。入住当天下午大门改造完毕，管家也是在第一时间联系告知，避免绕路，很贴心。这是一次很愉快的入住体验，早餐很不错，晚安甜品也很美味，下次来乐山还会选择安珀，点赞👍🏻
297,普通客户,未知,餐饮问题,64,法国有名的酒店品牌。酒店很有设计特色，服务很有水准，酒店和餐厅在硬体上没有可以挑剔的地方。乐山可以住到这样的酒店，很难得的体验。
304,家庭客户,未知,房间设施,440,"春节期间，一家老小因乐山大佛而来，不吐不快:
1.酒店的硬件设施确实做得不错，设计应该花了很多心思
2.办入住，前台小姐姐很热情，一家人也很开心住到一个温馨的酒店
3.夜里九点半左右给孩子洗澡，一直是半凉的水，给前台电话，告知洗的人太多热水用完了，需要等半小时，于是赶紧把小孩擦干抱床上等热水来
4.等了半小时还是凉水，于是又等了半小时
5.过了一个小时后还是凉水，给前台电话，说工程队还需要十分钟左..."
305,家庭客户,未知,"房间设施, 餐饮问题, 位置交通",183,不喜欢华邑的风格，通过携程搜索，发现乐山安珀，被种草，就预定下来。提前管家打电话联系入住注意事项后入住顺利，有停车场，房间比较大，装修是喜欢的风格。入住有欢迎卡片及水果，非常贴心。枕头比较舒服，带小朋友加被子也很顺利。枕头合适，睡眠舒服，周围环境安静。早餐有乐山小吃，不错。还是提醒一下，浴缸就在门厅中，没有门及隔断。还有酒店距离美食街较远。喜欢热闹的不用考虑这儿。
315,情侣客户,未知,餐饮问题,149,第一次写酒店点评，细节很感人，从办理入住到退房，一整个服务体验很好。不管是酒店的品质，还是公区的改造，都很好。睡了懒觉还特意上门送了早餐，退房的时候还给了小礼物伴手礼。真的很久没有住到服务这么好的酒店了。仪式感大满足😌，过来刚好过七周年纪念日，唯一的遗憾就是没有拍什么图片，下次来乐山还会再来入住。
324,普通客户,未知,房间设施,170,选择这家酒店是在线上看重了这家酒店的颜值，入住前管家就提前加微信，了解了我的需求，安排了停车位！服务上没有话说！入住时，酒店的装修品质映衬了高级感，设施设备都很好！还有心的设置了欢迎小卡片！唯一美中不足的就是外部环境，很一般，和酒店的颜值完全不匹配，矗立在一堆品质一般的小区群里面，也没有什么景观，推开窗就是工地，环境上和安珀的定位相差太大
330,普通客户,未知,位置交通,48,这是入住的第二家安珀，离高铁站更近一些，如果想吃吃吃，就挺远的。 仅有一次的乐山安珀入住经历了吧
349,普通客户,未知,其他,18,非常开心又回来入住啦，谢谢小方和小帅
355,普通客户,未知,"房间设施, 餐饮问题, 位置交通, 预订问题",372,"非常非常好的宝藏酒店！预订的时候看照片以为是快捷酒店那种又粉又绿的廉价装修…结果到了才发现完全不是好吗！堪比瑰丽丽思这种级别的硬件设施，装修非常有质感，从电梯框到大堂到餐厅到房间，无一不体现着质感和品味，体验感太好以至于不舍得离开…希望安珀能越做越好，始终保持这种高水准，期待在越来越多的城市见到这个品牌！
另外还要重点好评两位前台员工（Lola和管家Lip中文名可能是Xiaoyuan？）我们入住的..."
357,普通客户,未知,其他,78,这家酒店是我盲订的。结果真的让我太惊喜咯。从进酒店开始。真的不管是服务还是环境。真的很好。想来乐山的耍的小伙伴。这家不会让你失望。我以后来乐山都只住这家咯。
358,普通客户,未知,"房间设施, 餐饮问题, 价格争议, 清洁卫生",448,"环境：新发型的一家酒店，五一刚营业，进门像一个暗门酒廊的感觉，放满了花瓶和鲜花，电梯到达前台后是电子屏幕和沙发，更像设计师家里的客厅，氛围感拉满；另一个分区就是餐厅和室外露台，健身房在同一层，泳池暂时还没修建好有点可惜，公共区是我喜欢的风格～
房间就是明显卧室和浴室的分区，干湿分区，浴缸和化妆间的分区，卧室内有木门进行隔离，隔音效果非常好，整体像写字楼改造的酒店，不算大但装修很新。

卫生：才装修..."
363,普通客户,未知,"服务问题, 预订问题",93,"酒店装修风格不错。
管家服务太差，服务态度差，不耐烦，回复说话很冲，难以想象是星级酒店的员工言行。
时候负责人来沟通，说什么以后大家都不会见面了不必在意blabla，这沟通水平也是服了。"
366,商务客户,未知,"房间设施, 餐饮问题, 价格争议, 清洁卫生",578,"第一次和同事两人到乐山出差并借此机会游玩一下，抵达乐山火车站才临时订的酒店。一般我都会预定新的和品牌的酒店（因为卫生、服务、配套都比较有保障），浏览了一圈平台意外发现了乐山安珀酒店，急忙订了一个双床房。
看了酒店介绍才知道是一个有一百年历史的法国品牌，未入住光看评论和照片已经满怀期待了。
酒店离火车站很久十分钟车程就到了，到达酒店时门口就给人一种气派又神秘的感觉，迎宾带我们到四楼checkin，和..."
368,普通客户,未知,其他,41,整个酒店艺术气息很浓，在乐山能住到这么舒服的酒店很难得，前台小郭管家小娟服务态度好
376,普通客户,未知,"房间设施, 餐饮问题",129,房间很好！有管家对接， 唯一不足的是暖气不够，走的时候也充分询问了我们的意见，餐厅的早餐精致有特色，当地的跷脚牛肉， 蛋烘糕，钵钵鸡都有。 整体的布置很温馨舒适，矿泉水是环保包装，mini bar的峨眉雪真的是一秒很惊喜， 到房间保温杯装的银耳汤很温暖用心。
392,商务客户,1晚,房间设施,151,到乐山出差，原本计划完成工作回成都，但是工作没有做完，临时决定在乐山住一晚，刚好在万达附近搜到这家酒店，想着尝试一下，没想到酒店设施设备可以说是乐山酒店的天花板，服务也超级好，为我办理登记的Beata和Amy小姐姐都超级热情，入住期间竭尽全力的满足我的需求。如果下次有机会再来乐山，安珀一定是我的首选。
415,普通客户,未知,"服务问题, 房间设施, 餐饮问题, 清洁卫生",241,"总体感觉物超所值。酒店设计非常漂亮，很有品味，细节非常有档次。客房水平一流，设施高级，床品舒服，卫生干净，提供的用品都不错，能看出很用心。欢迎水果新鲜种类丰富，早餐一级棒，特别是西餐类的很好吃，各种小吃都有，淡季出品会减少一些。
可能是新开业的关系，客房人员的服务水平有点参差不齐。一线员工的服务意识和水平还要加强，某些员工比较僵硬冷漠，很可惜。后来经理回访态度非常好，相信他们一定会改进。在乐山这个..."
417,普通客户,未知,"房间设施, 餐饮问题",107,酒店很有设计感，房间也很新，细节都做得不错，超级喜欢他家的柠檬水，前台还专门做了一瓶柠檬水送到房间，真的有心了！本来对酒店早餐很有期待，第一天下去比较晚，有的东西没了，第二天是点单模式，就减少了好多东西，有点遗憾！
423,商务客户,1晚,"房间设施, 价格争议, 位置交通, 清洁卫生",545,"1、酒店服务极差。订了两间房间，中午2点到酒店办入住，前台理直气壮的说卫生打扫不过来，让我们一行人自行在大厅等待，（酒店大厅非常小，等房间的人特别多，沙发上都挤满了人）一直等到下午5点在我们的强行要求下才勉强仅收拾了一间房间让我们一行人先落脚。期间没有任何工作人员提供任何服务，甚至连水都未提供喝的。工作人员都是能敷衍就敷衍，且没有任何歉意，要是不态度强硬些，指不定要等到晚上去。
    2、所谓的..."
428,普通客户,2晚,"服务问题, 房间设施",161,订了两间两晚，第一天入住刚打开房门一股难闻的抹布水味道，放了台空气净化器稍微好点。第二天上午离开酒店的时候跟管家说了麻烦两间房打扫下，结果下午四点多回来发现两间房依旧没打扫，然后继续催了两三次依旧没人来打扫……不要说因为假期人手不够这种说辞，所有酒店都是这样啊，服务跟不上就不要找藉口。体验感真是不舒服，下次也不会再来了。
439,普通客户,未知,房间设施,129,已经是第四次入住了 各方面都很好  因为睡眠不好 所以对酒店的隔音各方面都比较挑剔 但这里给了我家的感觉 很安静 不被打扰 服务很好 需要什么管家服务基本都能满足  前台的小赵和小颖也是很贴心 入住前反复确认了对房间的要求 退房后还关心入住体验  真的很贴心
453,商务客户,未知,价格争议,32,很一般。服务态度和贵阳安珀完全没发比。前台工作人员没有一丝笑容。
468,普通客户,未知,"服务问题, 餐饮问题",428,从进门开始就有那位司机师傅引导我们进去，服务态度真的非常好，他全程帮助了我们拿行李，带我们到大堂。入住后酒店真的非常舒适也很干净，有私人管家帮助我们，欢迎水果也不错，很喜欢那里的矿泉水，包装很特别，我很喜欢。后续点的外卖私人管家都会帮助我们送上来，那个戴眼镜的小哥哥服务态度也很好，酒店所有的员工的服务意识也是好的，由于前一天晚上太晚离开健身房没有找到大门，后续管家和经理也马上解决了这个问题，不过还...
479,普通客户,未知,其他,48,管家小代态度很好，及时补充了欢迎水果，前台小郭解答疑问很细心，但遗憾未能延时退房，春节大假理解吧
558,普通客户,未知,房间设施,73,体验感不错，离万达很近周边吃美食也方便，房间专门有化妆镜 还有免费的饮品 很贴心 前台服务也很好 尤其是小鱼 很有耐心 帮忙解决问题 下次还会来的
563,家庭客户,未知,其他,17,"小朋友非常喜欢
下次还会考虑入住。"
577,普通客户,未知,其他,5,隔音太差了
583,普通客户,未知,房间设施,11,房间有些小细节需要修改
596,普通客户,未知,"房间设施, 位置交通, 清洁卫生",155,乐山挺不错的一家酒店，风格设计的还不错，服务人员都非常好，很热情；卫生干净整洁，房间面积也挺大的，智能马桶很不错，热带雨林和花洒还能同时出水，还有防烫伤调节温度功能，尽显细节，在乐山这个旅游城市来说已经很不错了，距离美食街也不算远；办理入住的小郭快速效率高，退房的时候小方和小杨还送了乐山的特产米花糖，很热情。
616,普通客户,未知,其他,52,环境很好，对接的管家小帅小王和前台小钱服务都很好，酒店整体非常不错，可以说是零差评，给乐山之行锦上添花。
622,普通客户,未知,"房间设施, 位置交通",73,房间很不错 管家小方小帅服务体贴 下雨不方便出行还送了雨伞 前台办理入住也很丝滑全程服务都是甜美的笑容 体验很棒 这次来玩的很开心 下次还会过来的
626,普通客户,未知,"房间设施, 位置交通",87,这家酒店布置不错，有很多可爱的绿植，整体文化感比较强，晚上睡觉比较安静，酒店出来不远有大型商圈，吃东西方便，另外，小雪提供的管家服务周到，房间里的卡片估计是她写的，字很好看。
629,普通客户,未知,"价格争议, 预订问题",15,房型好，除了贵点，没什么缺点！
632,商务客户,未知,"房间设施, 餐饮问题, 位置交通",117,"服务：管家小方工作认真负责，为人真诚，服务太到位了，对酒店的好感顿时拉满。连出租车司机都说这家酒店的服务是乐山最佳。
设施：一流，别家没有的这家有。
餐饮：味道好，食材质量高，跷脚牛肉、蛋烘糕比外面的还好吃，水果质量远超很多大牌五星。"
636,普通客户,未知,位置交通,93,"特别喜欢他们的大门和大堂
过来听出租车师傅说这里是新区，离张公桥不太近不方便，但是住了后发现距离也还好，主要是酒店太棒，服务也很好，管家小方特别温柔耐心，下次来还会选这里，距离不是问题。"
647,商务客户,未知,"房间设施, 餐饮问题, 价格争议",84,原来住过贵阳的安珀几次就对这家酒店印象比较深刻，没想到乐山也有，这次来出差，没有丝毫的犹豫又来了。小黄经理和管家小周的服务超级好，也很贴心。房间很大很宽敞，早餐也很好吃
651,普通客户,未知,"房间设施, 价格争议, 预订问题",205,重庆自驾过来三个多小时 旁边都是新盘居多 房间风格好似中式与法式的融合 周边有万达广场 停车可以就停平层也有地下停车场 喜欢13楼和14楼是SPA接待处和spa与冥想的地方 很安静 spa做完也很舒服 感觉比大堂那些都要漂亮 酒店每层楼层高很高 房间距离嘉兴路那些开车大概十几分钟 附近有个熊老大过桥米线好吃 希望下次来能住到粉色那个房型 看起来很少女 前台小娟和管家小郭服务滴很贴心 电视不能投屏是...
652,普通客户,未知,"房间设施, 餐饮问题, 位置交通, 清洁卫生",109,酒店挺不错的，交通还算方便的，附近大商场，离高铁站也不远，提前预约了接送服务，司机祝师傅服务和小代服务很好。安珀酒店设计很有特点，房间卫生干净，设备质量不错。前台办理入住的小赵服务效率很高，还有早餐厅的小姑娘非常热情。
672,商务客户,未知,房间设施,63,安珀酒店整个配套设施是很不错的，工作人员服务很到位，小黄经理、前台小郭和小娟均专业热情，第一时间解决问题，下次到乐山再入住安珀
693,普通客户,未知,"房间设施, 清洁卫生",105,酒店挺好的，房间干净卫生空间大采光好，空调效果也好，前台小方响应迅速，及时解决各类问题，退房时还热情协助搬运行李，管家小娟在入住前主动联系，细心确认需求，服务贴心周到。整体体验很舒适，我们住的很满意，值得推荐。
695,商务客户,未知,"房间设施, 位置交通",128,这次入住安珀酒店非常满意！前台小郭和小方服务热情高效，工作人员快速办理入住和退房、解决需求，细节周到让人如沐春风。房间装修风格简约温馨，浅绿色背景墙+暖色调搭配自然，床品舒适，设施智能便捷。特别喜欢洗漱区域的设计，既美观又实用。整体体验远超预期，强烈推荐！
700,普通客户,未知,"房间设施, 餐饮问题",134,这次入住的酒店真的让我惊艳，从进门的那一刻起，热情的服务让我感受到温馨，前台小赵办理入住迅速，推荐美食，房间也很大舒适，酒店周边就是万达，逛也方便，管家小郭更是服务细心，有什么问题都是第一时间解决，推荐的油炸也好吃，早餐也很丰富，味道很赞，总之这是一次超棒的住宿体验。
701,普通客户,未知,房间设施,160,第二次来乐山游玩，第一次定安珀，实地到了酒店感觉很惊艳，体验特别好，给这次旅行增色不少。酒店装修风格独特别致，房间干净整洁，隔音效果好，晚上可以安心入睡。健身房器材齐全干净，装修也很大气。管家小赵亲切温暖，前台小李很热情，房间送的下午小点心很精致，迎宾水果新鲜好吃，拖鞋质量很好，穿起来很柔软。下次来还会继续定这家酒店。
702,普通客户,未知,房间设施,84,"前台小娟办理入住很迅速，活动都仔细给我们介绍了，房间需要送东西联系管家小方也是很快就送来了。提前告知了房间喜好，两个房间挨在一起很不错
唯一缺点，没有配备洗衣房和烘干机"
717,普通客户,未知,"房间设施, 清洁卫生",111,"安珀果然没让我失望…每天都有水果，小糕点，我们房间的管家服务也是超棒的，点名表扬管家小徐和小雷。
卫生：100分
设施：100分
环境：100分
服务：100分
迷你吧:牛奶、矿泉水、饮料都有
欢迎水果:每天都有
展开更多"
728,商务客户,未知,餐饮问题,71,这个酒店相当不错，我是经常出差的，经常住酒店，都被惊艳到了！比我在沿海住的很多五星级酒店都要好！特别是他们的早餐服务，管家小方服务也很贴心！！
735,普通客户,未知,房间设施,101,酒店整体来说都是不错的，在乐山这个城市应该是最好的了。整体偏法式风格，床垫很舒服，睡得很好。前台小娟办理入住退房很迅速，有需要联系管家小郭回应也很快。唯一的缺点就是差个送外卖的机器人。总体来说还是推荐！
736,普通客户,未知,其他,45,酒店设计感很强，很喜欢。管家小袁小方贴心周到，有问题及时处理，下次来乐山还会入住安珀酒店！
756,普通客户,未知,房间设施,235,"安珀酒店服务非常好。第一次入住给我升级了房间，房间非常宽敞舒适，各种设施也很好。整个酒店设计风格走奢华极简路线，个人很喜欢，唯一稍微有点想吐槽的是，设计过于极简导致房间里有些开关很难找🤣。
在高铁上非常临时地问管家有没有车站接送服务，管家小雷都能很及时地给我安排好司机。整个入住过程我有任何问题，小雷和小方都能及时回复我。服务非常好。送站当天，管家也帮我联系好司机早上提前上班送我们去车站。
另外，下..."
762,家庭客户,未知,其他,6,小朋友很喜欢
763,普通客户,未知,"房间设施, 餐饮问题, 预订问题",129,"房间挺新，挺雅致的。
服务人员很亲切，早餐的面条好好吃。
还有很基础的豆浆油条，油条很脆超好吃。
虽然菜品比较少，但是都很不错。
小酥肉香酥，水果🍉新鲜。
入住时还给升房了。
管家小帅，小代和经理小黄都很赞噢👍

周边还在建设中，希望可以越来越好。
展开更多"
768,普通客户,未知,餐饮问题,100,酒店艺术氛围，离万达也很近，早餐丰富有乐山特色翘脚牛肉等味道跟外面差不多，管家小代和小袁服务周到细心，会提前打电话联系，送外卖也很快，前台小郭也很专业办入住很快，非常满意，下次来乐山还会选择这家酒店！
770,普通客户,未知,其他,97,不愧是府邸式管家服务，非常棒，体验很好，入住前就会致电问我入住需求，尤其是小方和小帅，给我推荐美食，回复及时，有什么问题第一时间解答，前台退房的时候还送了伴手礼，很不错，下次来乐山还会选择安珀。
779,家庭客户,未知,"房间设施, 餐饮问题",165,"今年五月新开的，应该是当地最好的酒店了，硬件好于洲际标准，服务也贴心，专业管家服务，尤其前台小朱经理，check in,out都帮我们拿行李并送至停车场，点赞；另外酒店早餐丰富精致，大厨也非常热情专业，亲自在现场指导服务人员，我们有带小朋友想吃炒饭，也特意现做了炒饭；临走时还每个房间赠送了小礼品；唯一的不足就是健身房稍小了一点。"
